### ISSUE TITLE
network access is partially restricted, AI-Agent+DeepSeek returns an error message-timeout.

### ISSUE THREAD

**Issue by ssssenai** [n8n-io/n8n#17657]
## Describe the problem/error/question
Under the same configuration and flow

- The access times out within China.
- The virtual host in the US can return results normally.

Using the deepseek node alone is OK, 
but errors occur when deepseek is attached to the AI-Agent node.

I suspect that although it is not necessary, the AI-Agent node code still calls websites that cannot be accessed in China, such as [api.openai.com](https://api.openai.com/).
Because I saw similar output during the test on the US host (not the reported version).
`
21:25:30.221426 IP 172.17.0.3.5678 > 221.219.99.153.20598: Flags [P.], seq 628:719, ack 26, win 501, length 91
21:25:30.224784 IP 172.17.0.3.34716 > 100.100.2.136.domain: 3032+ A? api.openai.com. (32)
21:25:30.224914 IP 172.17.0.3.34716 > 100.100.2.138.domain: 3032+ A? api.openai.com. (32)
21:25:30.224935 IP 172.17.0.3.34716 > 100.100.2.136.domain: 3252+ AAAA? api.openai.com. (32)
21:25:30.224943 IP 172.17.0.3.34716 > 100.100.2.138.domain: 3252+ AAAA? api.openai.com. (32)
21:25:30.225298 IP 100.100.2.138.domain > 172.17.0.3.34716: 3032 1/0/0 A 199.59.150.40 (48)
21:25:30.225314 IP 100.100.2.138.domain > 172.17.0.3.34716: 3252 1/0/0 AAAA 2a03:2880:f136:83:face:b00c:0:25de (60)
21:25:30.225368 IP 100.100.2.136.domain > 172.17.0.3.34716: 3032 1/0/0 A 199.59.150.40 (48)
`

## What is the error message (if any)?

`{
  "errorMessage": "Connection error.",
  "errorDetails": {
    "rawErrorMessage": [
      "Connection error."
    ]
  },
  "n8nDetails": {
    "nodeName": "AI Agent-test",
    "nodeType": "@n8n/n8n-nodes-langchain.agent",
    "nodeVersion": 2.1,
    "time": "2025/7/25 10:32:02",
    "n8nVersion": "1.102.4 (Self Hosted)",
    "binaryDataMode": "default",
    "stackTrace": [
      "NodeOperationError: Connection error.",
      "    at /usr/local/lib/node_modules/n8n/node_modules/.pnpm/@n8n+n8n-nodes-langchain@file+packages+@n8n+nodes-langchain_7e9d43189da28db518476f7779d5ed6f/node_modules/@n8n/n8n-nodes-langchain/nodes/agents/Agent/agents/ToolsAgent/V2/execute.ts:287:12",
      "    at Array.forEach (<anonymous>)",
      "    at ExecuteContext.toolsAgentExecute (/usr/local/lib/node_modules/n8n/node_modules/.pnpm/@n8n+n8n-nodes-langchain@file+packages+@n8n+nodes-langchain_7e9d43189da28db518476f7779d5ed6f/node_modules/@n8n/n8n-nodes-langchain/nodes/agents/Agent/agents/ToolsAgent/V2/execute.ts:276:16)",
      "    at processTicksAndRejections (node:internal/process/task_queues:105:5)",
      "    at ExecuteContext.execute (/usr/local/lib/node_modules/n8n/node_modules/.pnpm/@n8n+n8n-nodes-langchain@file+packages+@n8n+nodes-langchain_7e9d43189da28db518476f7779d5ed6f/node_modules/@n8n/n8n-nodes-langchain/nodes/agents/Agent/V2/AgentV2.node.ts:203:10)",
      "    at WorkflowExecute.runNode (/usr/local/lib/node_modules/n8n/node_modules/.pnpm/n8n-core@file+packages+core_openai@5.8.1_ws@8.17.1_zod@3.25.67_/node_modules/n8n-core/src/execution-engine/workflow-execute.ts:1212:9)",
      "    at /usr/local/lib/node_modules/n8n/node_modules/.pnpm/n8n-core@file+packages+core_openai@5.8.1_ws@8.17.1_zod@3.25.67_/node_modules/n8n-core/src/execution-engine/workflow-execute.ts:1582:27",
      "    at /usr/local/lib/node_modules/n8n/node_modules/.pnpm/n8n-core@file+packages+core_openai@5.8.1_ws@8.17.1_zod@3.25.67_/node_modules/n8n-core/src/execution-engine/workflow-execute.ts:2153:11"
    ]
  }
}`

## Please share your workflow/screenshots/recording
the most basic AI-Agent+DeepSeek flow

<img width="1053" height="350" alt="Image" src="https://github.com/user-attachments/assets/786b126a-fb53-406a-a4f1-828bd3b9ddd4" />

```
(Select the nodes on your canvas and use the keyboard shortcuts CMD+C/CTRL+C and CMD+V/CTRL+V to copy and paste the workflow.)
⚠️ WARNING ⚠️ If you have sensitive data in your workflow (like API keys), please remove it before sharing.
```

### core

- n8nVersion: 1.102.4
- platform: docker (self-hosted)
- nodeJsVersion: 22.17.0
- database: sqlite
- executionMode: regular
- concurrency: -1
- license: enterprise (production)

### storage

- success: all
- error: all
- progress: false
- manual: true
- binaryMode: memory

### pruning

- enabled: true
- maxAge: 336 hours
- maxCount: 10000 executions

### client

- userAgent: mozilla/5.0 (windows nt 10.0; win64; x64) applewebkit/537.36 (khtml, like gecko) chrome/140.0.0.0 safari/537.36
- isTouchDevice: false

### security

- secureCookie: false

Generated at: 2025-07-25T02:30:26.618Z}

**Comment by Joffcom** [comment]
Hey @ssssenai,

Thank you for reaching out! We’ve received your issue and are looking into it. To help us track this internally, we’ve created a Linear ticket with the reference: "GHC-3316".

We’ll keep you updated as we make progress, but if you have any additional details or context to share, feel free to add them here - it’s always helpful!

Thanks for your patience and for bringing this to our attention.

**Comment by ssssenai** [comment]
**api.openai.com Network state:**
```
root@iZ8vbgj920ls3yiz6xx86jZ:~# nslookup api.openai.com
Server:         8.8.8.8
Address:        8.8.8.8#53

Non-authoritative answer:
Name:   api.openai.com
Address: 128.242.240.189
Name:   api.openai.com
Address: 2a03:2880:f11f:83:face:b00c:0:25de

root@iZ8vbgj920ls3yiz6xx86jZ:~# ping  api.openai.com
PING api.openai.com (69.63.184.30) 56(84) bytes of data.
^C
--- api.openai.com ping statistics ---
57 packets transmitted, 0 received, 100% packet loss, time 57343ms
```

**api.deepseek.com Network state:**
```
root@iZ8vbgj920ls3yiz6xx86jZ:~# nslookup api.deepseek.com                       Server:         8.8.8.8
Address:        8.8.8.8#53

Non-authoritative answer:
api.deepseek.com        canonical name = f25089e3f8624be8804c1a64aa4c7043.vip1.huaweicloudwaf.com.
Name:   f25089e3f8624be8804c1a64aa4c7043.vip1.huaweicloudwaf.com
Address: 116.205.40.113
Name:   f25089e3f8624be8804c1a64aa4c7043.vip1.huaweicloudwaf.com
Address: 116.205.40.114

root@iZ8vbgj920ls3yiz6xx86jZ:~# ping api.deepseek.com
PING f25089e3f8624be8804c1a64aa4c7043.vip1.huaweicloudwaf.com (116.205.40.113) 56(84) bytes of data.
64 bytes from ecs-116-205-40-113.compute.hwclouds-dns.com (116.205.40.113): icmp_seq=1 ttl=51 time=12.2 ms
64 bytes from ecs-116-205-40-113.compute.hwclouds-dns.com (116.205.40.113): icmp_seq=2 ttl=51 time=12.0 ms
64 bytes from ecs-116-205-40-113.compute.hwclouds-dns.com (116.205.40.113): icmp_seq=3 ttl=51 time=12.3 ms
```

**Comment by gerayyy** [comment]
I encountered the same issue. n8n version: 1.105.4. Has there been any progress in resolving the problem?

**Comment by ssssenai** [comment]
I think that when the AI-Agent node is connecting to other AI engines (such as deepseek), it should not access any unrelated network addresses (such as api.openai.com).

**Comment by felipebrunosousa10-wq** [comment]
Correção
{
  "name": "AI-Agent DeepSeek Test",
  "nodes": [
    {
      "parameters": {
        "httpMethod": "POST",
        "path": "deepseek-test",
        "options": {}
      },
      "id": "1",
      "name": "Webhook",
      "type": "n8n-nodes-base.webhook",
      "typeVersion": 1,
      "position": [240, 300],
      "webhookId": "deepseek-test"
    },
    {
      "parameters": {
        "model": "deepseek-chat",
        "systemMessage": "Você é um assistente inteligente rodando no n8n com DeepSeek.",
        "messages": [
          {
            "text": "={{$json[\"body\"]}}",
            "role": "user"
          }
        ]
      },
      "id": "2",
      "name": "AI Agent (DeepSeek)",
      "type": "@n8n/n8n-nodes-langchain.agent",
      "typeVersion": 2,
      "position": [540, 300],
      "credentials": {
        "openAiApi": {
          "id": "REPLACE_WITH_YOUR_CREDENTIAL_ID",
          "name": "DeepSeek API"
        }
      }
    },
    {
      "parameters": {
        "responseMode": "onReceived",
        "options": {},
        "responseData": "={{$json}}"
      },
      "id": "3",
      "name": "Respond to Webhook",
      "type": "n8n-nodes-base.respondToWebhook",
      "typeVersion": 1,
      "position": [840, 300]
    }
  ],
  "connections": {
    "Webhook": {
      "main": [
        [
          {
            "node": "AI Agent (DeepSeek)",
            "type": "main",
            "index": 0
          }
        ]
      ]
    },
    "AI Agent (DeepSeek)": {
      "main": [
        [
          {
            "node": "Respond to Webhook",
            "type": "main",
            "index": 0
          }
        ]
      ]
    }
  },
  "settings": {},
  "staticData": null,
  "pinData": {},
  "versionId": "1"
}

**Comment by ssssenai** [comment]
> Correção
Thank you for your reply, but I specifically refer to the problem with the AI-Agent node when the network environment cannot access api.openai.com. 
There are other ways to use deepseek, but they don't have as many features as the AI-Agent node.

**Comment by mostcat** [comment]
[*] I have updated to the latest stable version of n8n [1.117.3] and I am still experiencing this issue
[ ] Please close this issue – I am no longer experiencing it
[ ] Please close this issue – [please specify a reason]

<img width="1431" height="772" alt="Image" src="https://github.com/user-attachments/assets/efda55c0-09fc-41fb-9c2f-04c7540e3b6c" />

## Debug info

### core

- n8nVersion: 1.117.3
- platform: docker (self-hosted)
- nodeJsVersion: 22.18.0
- nodeEnv: production
- database: sqlite
- executionMode: regular
- concurrency: -1
- license: enterprise (production)

### storage

- success: all
- error: all
- progress: false
- manual: true
- binaryMode: memory

### pruning

- enabled: true
- maxAge: 336 hours
- maxCount: 10000 executions

### client

- userAgent: mozilla/5.0 (windows nt 10.0; win64; x64) applewebkit/537.36 (khtml, like gecko) chrome/144.0.0.0 safari/537.36
- isTouchDevice: false

### security

- secureCookie: false

Generated at: 2025-11-03T05:32:37.552Z}
